{
  "$schema": "../../../../agent/schemas/component-agent.schema.json",
  "schemaVersion": "1.0.0",
  "id": "component:ds-message-composer",
  "kind": "component",
  "package": "@ds-mo/ui",
  "tag": "ds-message-composer",
  "audience": "general",
  "status": "experimental",
  "summary": "Two-line auto-growing conversation textarea with submit, stop, an attached submission-error support surface, and extensible tool, action, and error-recovery regions.",
  "useWhen": [
    "A conversation accepts multi-line text and needs Enter-to-submit with a streaming stop action."
  ],
  "avoidWhen": ["The text is a conventional form field submitted with unrelated fields."],
  "commonlyComposedWith": [
    "component:ds-message-scroller",
    "component:ds-button-filled",
    "component:ds-button-unfilled"
  ],
  "patterns": ["pattern:conversation"],
  "accessibility": [
    "Always provide a localized textarea label and submit or stop action names; the built-in icon action exposes the same name in its tooltip.",
    "Shift plus Enter inserts a newline while Enter submits non-empty content.",
    "Submission errors remain visible and announced above the editable box as part of one attached composer unit, and the editable control references their text while the error state is active.",
    "Streaming and error states remain perceivable without relying on icon shape or color alone."
  ],
  "states": [
    "The owner controls draft value and transport state; the composer emits intent without performing transport.",
    "Error status never clears or disables the draft; the application supplies recovery actions through error-actions and owns retry semantics. The negative support surface appears above and attached to the composer box, within the component's measured ownership.",
    "Use the tools slot for leading actions such as add and the actions slot for trailing actions such as dictation; the built-in submit or stop action remains last with an 8px gap from the preceding action. The built-in and application-provided composer buttons use the standard rounded control treatment, and the application supplies tooltips for slotted icon actions.",
    "The composer surface uses the 4px --dimension-radius-050 token.",
    "Mouse or keyboard focus on the textarea gives the complete composer surface the same bold-brand inset stroke width and color as an active Input; the native textarea never draws a separate outline.",
    "The empty or otherwise inactive submit action is a disabled bordered, rounded ButtonUnfilled. Ready submit actions use submitIntent and the rounded control treatment, while the streaming stop action remains a rounded bold-brand ButtonFilled.",
    "The attached error unit keeps a real boundary in forced colors and lets message text and application-owned recovery actions wrap at narrow widths."
  ],
  "responsiveBehavior": [
    "The textarea begins at two body-medium lines, grows one line at a time through six lines, and then scrolls internally."
  ],
  "references": [
    {
      "label": "Storybook examples",
      "path": "src/wc/components/MessageComposer/MessageComposer.stories.ts"
    },
    {
      "label": "Scroller overlay composition",
      "path": "src/wc/components/MessageScroller/MessageScroller.stories.ts"
    }
  ],
  "styling": {
    "rationale": "The component owns the protected recipes below; unspecified host properties and application layout remain customizable.",
    "protected": [
      {
        "properties": ["background", "border", "box-shadow", "color"],
        "reason": "The component owns its surface and interaction treatment; use its semantic presentation props or compose an application-owned surrounding surface.",
        "props": []
      },
      {
        "properties": ["border-radius"],
        "reason": "The component owns its surface radius; retain the shared recipe and customize an outer wrapper when needed.",
        "props": []
      }
    ],
    "customProperties": []
  }
}
