{
  "$schema": "../../../../agent/schemas/component-agent.schema.json",
  "schemaVersion": "1.0.0",
  "id": "component:ds-conversation-list-section",
  "kind": "component",
  "package": "@ds-mo/ui",
  "tag": "ds-conversation-list-section",
  "audience": "general",
  "status": "experimental",
  "summary": "Semantically labelled section for grouping conversation rows by meaningful chronology or category.",
  "useWhen": ["A conversation list needs visible groups such as Today, Yesterday, or Older."],
  "avoidWhen": ["A flat list is clearer or the proposed grouping has no meaning to readers."],
  "commonlyComposedWith": ["component:ds-conversation-list", "component:ds-conversation-list-item"],
  "patterns": ["pattern:conversation"],
  "accessibility": [
    "The visible heading labels the section and must describe the relationship shared by its rows."
  ],
  "responsiveBehavior": [
    "Rows remain full width with a 4px gap between adjacent items while the heading stays visible in document order."
  ],
  "references": [
    {
      "label": "Storybook examples",
      "path": "src/wc/components/ConversationList/ConversationList.stories.ts"
    }
  ],
  "styling": {
    "rationale": "The component owns the protected recipes below; unspecified host properties and application layout remain customizable.",
    "protected": [
      {
        "properties": ["gap"],
        "reason": "The component owns spacing between its immediate content regions; the application controls surrounding margins and placement.",
        "props": []
      }
    ],
    "customProperties": []
  }
}
