{
  "$schema": "../../../../agent/schemas/component-agent.schema.json",
  "schemaVersion": "1.0.0",
  "id": "component:ds-agent-tool-call",
  "kind": "component",
  "package": "@ds-mo/ui",
  "tag": "ds-agent-tool-call",
  "audience": "specialized",
  "status": "experimental",
  "summary": "Compact display-only status row for a provider-neutral agent tool lifecycle with optional custom result and diagnostic disclosure surfaces.",
  "useWhen": [
    "An agent product needs to expose user-safe tool preparation, queueing, execution, participant wait, completion, failure, denial, or cancellation state."
  ],
  "avoidWhen": [
    "A participant must approve, deny, edit, retry, or execute the tool call; those product controls and consequences remain outside this component."
  ],
  "commonlyComposedWith": [
    "component:ds-agent-response",
    "component:ds-code-block",
    "component:ds-text"
  ],
  "patterns": ["pattern:agent-chat"],
  "accessibility": [
    "Every lifecycle state remains visible as text and error or denied meaning does not depend on color.",
    "A disclosure is rendered only when details exist and uses native keyboard and expanded-state semantics.",
    "Structured input, output, and error details use the semantic code-family fallback and optional ligature override."
  ],
  "states": [
    "Applications normalize provider-specific tool states and may localize the visible status label before rendering.",
    "A custom summary replaces the generated name, a custom result owns the primary result surface, and custom details replace generic input, output, and error diagnostics.",
    "An ordinary text-only custom result inherits the body-medium interface-text baseline; structured result components retain ownership of their own layout and typography.",
    "Compose semantic links around ds-text when a custom result is navigational so anchor semantics and design-system typography each have one owner.",
    "Applications load font assets once at their root; tool details and results never fetch or package a font.",
    "This component presents state but never executes a tool or owns approval, retry, authorization, transport, or consequence policy."
  ],
  "responsiveBehavior": [
    "Long names and state labels wrap inside the compact row while custom results and structured diagnostics remain within the transcript lane without widening it."
  ],
  "references": [
    {
      "label": "Lifecycle and slot stories",
      "path": "src/wc/components/AgentToolCall/AgentToolCall.stories.ts"
    },
    {
      "label": "Font ownership and loading",
      "path": "docs/font-ownership.md"
    }
  ],
  "styling": {
    "rationale": "Slotted tool summaries and results retain application-owned styling and layout.",
    "protected": [],
    "customProperties": []
  }
}
