{
  "$schema": "../../../../agent/schemas/component-agent.schema.json",
  "schemaVersion": "1.0.0",
  "id": "component:ds-chart-legend",
  "kind": "component",
  "package": "@ds-mo/ui",
  "tag": "ds-chart-legend",
  "audience": "specialized",
  "status": "stable",
  "summary": "External chart legend with swatches, labels, optional values and percentages, and explicit deep links.",
  "useWhen": [
    "A chart needs the standard swatch, label, and optional numeric-detail legend.",
    "Polar slices or Cartesian series need a continuously visible key beside or below the visualization.",
    "A category has an explicit deep-link destination and should render as an accessible link."
  ],
  "avoidWhen": [
    "The design calls for chips, bare swatches, external stat callouts, or another custom legend treatment.",
    "Rows need to toggle visibility, filter data, or represent selection.",
    "The content is a command menu or navigation list unrelated to chart data."
  ],
  "alternatives": [
    {
      "when": "The product needs a nonstandard legend treatment.",
      "component": "component:ds-text",
      "reason": "Compose product-owned semantic markup from the same chart data rather than forcing it into this row recipe."
    },
    {
      "when": "A chart and static series key belong in the canonical dashboard card.",
      "component": "component:ds-card-chart",
      "reason": "The chart variant places the external legend and disables decorative local hover highlighting."
    }
  ],
  "commonlyComposedWith": ["component:ds-chart", "component:ds-card-chart"],
  "accessibility": [
    "Rows remain non-interactive unless the item supplies an actual link destination.",
    "Optional highlighting dims peer swatches while preserving text contrast; it never moves focus or announces selection.",
    "Keep full labels available when visible text truncates, and retain stable tabular numeric columns.",
    "Do not rely on swatch color alone; every entry requires a meaningful visible label."
  ],
  "states": [
    "Local pointer or focus interaction and external chart highlight remain separate; both may dim peer swatches, but only a real link row receives navigation affordances.",
    "Disable local hover highlighting for static keys such as a line-chart legend; externally controlled activeLabel highlighting and genuine link affordances remain available.",
    "Hover synchronization is temporary emphasis, never filtering, toggling, or selected state.",
    "Percentage values use one consistent precision across the complete legend.",
    "The list owns pointer leave so moving across row gaps does not clear and reapply highlight."
  ],
  "responsiveBehavior": [
    "Vertical legends let the label yield width and truncate before right-aligned value and percentage columns.",
    "Horizontal legends wrap complete entries and suit compact series keys below a chart.",
    "The parent constrains width and decides when a custom condensed treatment is necessary."
  ],
  "frameworkCaveats": {
    "customElements": [
      "Assign items as a JavaScript property and set href only for genuine navigation."
    ],
    "react": [
      "Intercept the item-click event only when application routing must replace native link navigation."
    ],
    "angular": [
      "Intercept the item-click event only when application routing must replace native link navigation."
    ]
  },
  "references": [
    {
      "label": "Storybook examples",
      "path": "src/wc/components/ChartLegend/ChartLegend.stories.ts"
    },
    {
      "label": "Rendered interaction tests",
      "path": "tests/e2e/chart-legend.spec.ts"
    }
  ],
  "styling": {
    "rationale": "Legend content owns internal rows; application layout may constrain and position its host.",
    "protected": [],
    "customProperties": []
  }
}
